index,tags,ukr_title,ukr_text,similar_titles,similar_idx,masked_text,masked_title,label
9816,"vibukh,vijna,mikolajiv","У Миколаєві через обстріл стався вибух біля зупинки: 3 загиблих, 12 поранених","Внаслідок обстрілу Миколаєва касетними снарядами стався вибух в районі зупинки громадського транспорту, 3 людей загинули і 12 дістали поранень. Джерело: мер міста Олександр Сєнкевич у Telegram, голова Миколаївської облради Ганна Замазєєва у Facebook Дослівно: ""Вибух в районі зупинки громадського транспорту. Касетні снаряди. Є жертви. Працюють усі служби. Деталі потім"". Деталі: Пізніше голова Миколаївської облради Ганна Замазєєва повідомила, що внаслідок вибуху 2 осіб загинуло, 12 дістали поранень. Станом на 19:20 Сєнкевич повідомив, що відомо про 3 загиблих та 12 поранених. Також є пошкодження житлових будинків і електромереж. Що передувало: У ніч на 29 вересня місто Миколаїв зазнало ракетного удару з боку росіян, пошкоджено цивільні об’єкти.","['У Миколаєві пролунали вибухи – ЗMI', 'Готуємося до нападу чи облоги Миколаєва – мер ', 'У Миколаєві чули вибух. Кім запевняє, що це не у місті', 'Віталій Кім: Нас все більше — росіян все менше, готуємося до посівної', 'Російська ракета пошкодила сортувальне депо ""Нової пошти"" в Миколаєві', 'У Миколаєві потужні вибухи – мер', 'Миколаїв: Лунають вибухи касетних снарядів', 'У Миколаєві через обстріл стався вибух біля зупинки: X загиблих, XX поранених', 'У Миколаєві пролунали вибухи – мер', 'Миколаїв: Росіяни вдарили в багатоповерхівку, кількість загиблих зросла']","[3648, 7609, 4881, 1039, 6114, 1603, 7378, 4, 2276, 7431]","Внаслідок обстрілу Миколаєва касетними снарядами стався вибух в районі зупинки громадського транспорту, X людей загинули і XX дістали поранень. Джерело: мер міста Олександр Сєнкевич у Telegram, голова Миколаївської облради Ганна Замазєєва у Facebook Дослівно: ""Вибух в районі зупинки громадського транспорту. Касетні снаряди. Є жертви. Працюють усі служби. Деталі потім"". Деталі: Пізніше голова Миколаївської облради Ганна Замазєєва повідомила, що внаслідок вибуху X осіб загинуло, XX дістали поранень. Станом на XX:XX Сєнкевич повідомив, що відомо про X загиблих та XX поранених. Також є пошкодження житлових будинків і електромереж. Що передувало: У ніч на XX вересня місто Миколаїв зазнало ракетного удару з боку росіян, пошкоджено цивільні об’єкти.","У Миколаєві через обстріл стався вибух біля зупинки: X загиблих, XX поранених",7.0
1763,"nagorodi,zelensky,zbrojni-sili",Президент присвоїв звання Герой України ще 6 військовим,"Президент України відзначив ще 152 військовослужбовці державними нагородами, зокрема й присвоїв звання Герой України. Джерело: звернення Зеленського, укази президента Пряма мова: ""І традиційно перед записом цього звернення я підписав указ про нагородження наших українських героїв. Державними нагородами відзначені 152 військовослужбовці Збройних Сил України, із них троє – посмертно"". Деталі: Зеленський посмертно присвоїв звання Герой України з удостоєнням ордена ""Золота Зірка"" Бондаруку Віталію Анатолійовичу – старшому лейтенанту. Крім того, присвоїв звання Герой України з врученням ордена ""Золота Зірка"" Вересу Кирилу Кириловичу – майору; Зугравому Олександру Вячеславовичу – полковнику; Кулагіну Родіону Анатолійовичу – полковнику; Старченку Сергію Олександровичу – підполковнику; Царенку Андрію Юрійовичу – майору. Також президент відзначив військових орденами Богдана Хмельницького, Данила Галицького, ""За мужність"".","['Зеленський нагородив орденами і медалями XX захисників України', 'Президент нагородив орденами і медалями ще XXX військових', 'Президент обіцяє зміни щодо недбалості, радянщини й бюрократії в Силах оборони', 'Президент присвоїв звання Героя за знищення десятків одиниць техніки РФ', 'Зеленський: Україна більше не платитиме суверенітетом за примарні обіцянки спокою', 'Зеленський змінив командувача Сил спеціальних операцій', 'Головний сержант, з яким зустрічався Зеленський, поскаржився на командування', 'Президент присвоїв звання Герой України ще X військовим', 'Зеленський нагородив ще XXX військових', 'Зеленський відзначив державними нагородами XXX військовослужбовця']","[2854, 1821, 8575, 8328, 3893, 1994, 8111, 5, 7486, 1173]","Президент України відзначив ще XXX військовослужбовці державними нагородами, зокрема й присвоїв звання Герой України. Джерело: звернення Зеленського, укази президента Пряма мова: ""І традиційно перед записом цього звернення я підписав указ про нагородження наших українських героїв. Державними нагородами відзначені XXX військовослужбовці Збройних Сил України, із них троє – посмертно"". Деталі: Зеленський посмертно присвоїв звання Герой України з удостоєнням ордена ""Золота Зірка"" Бондаруку Віталію Анатолійовичу – старшому лейтенанту. Крім того, присвоїв звання Герой України з врученням ордена ""Золота Зірка"" Вересу Кирилу Кириловичу – майору; Зугравому Олександру Вячеславовичу – полковнику; Кулагіну Родіону Анатолійовичу – полковнику; Старченку Сергію Олександровичу – підполковнику; Царенку Андрію Юрійовичу – майору. Також президент відзначив військових орденами Богдана Хмельницького, Данила Галицького, ""За мужність"".",Президент присвоїв звання Герой України ще X військовим,7.0
7378,"donetsk,azov,okupacia,mariupol","Окупанти заявили, що посадили на 22 роки мінометника з ""Азова""","Окупаційна влада вирішила посадити за ґрати на 22 роки українського військовослужбовця, мінометника полку ""Азов"" Едуарда Варбанського. Джерело: ТАСС із посиланням на пресслужбу Головної військової прокуратури Росії Деталі: Як повідомляє 27 вересня російське пропагандистське агентство, ""Верховний суд"" так званої ""ДНР"" засудив Едуарда Варбанського до 22 років позбавлення волі ""за мінометний обстріл школи під Маріуполем навесні минулого (2022) року"". Як говорить на відео чоловік, який назвався Варбанським, його звинуватили в ""жорстокому поводженні з цивільним населенням, замаху на вбивство та навмисному знищенні чужого майна"" через обстріл селища Бердянське під Маріуполем із міномета калібру 120 мм. Тоді нібито постраждала школа. Цьому передувало: 22 вересня російські пропагандисти повідомили, що ""Верховний суд"" незаконної ""ДНР"" засудив до 24 років позбавлення волі старшину розвідувальної роти ЗСУ Віталія Катранича, який нібито застрелив жителя Маріуполя.","['Окупанти заявили, що посадили на XX роки мінометника з ""Азова""', 'У Маріуполі все гірше з водою та ексгумацією, жителів лякають ""націоналізацією"" – Андрющенко', 'Викрадену окупантами доньку загиблого в Маріуполі чемпіона України повернули дідусеві', 'Росіяни знову вимагають від захисників Маріуполя здатися в полон', 'Мракобісся і регрес: під Маріуполем демонтували пам\'ятник Сагайдачному, бо його ставив ""Азов""', 'Гарнізон ""Маріуполь"" виконав завдання, віддано наказ зберегти життя – Генштаб', 'Маріуполь: окупанти під виглядом житла будують фортифікаційні споруди – мер ', 'Ворог продовжує штурм ""Азовсталі"", захисники стримують росіян – Азов ', 'Командир ""Азову"" каже, що вони виконали завдання і хоче зберегти життя підлеглим\xa0', 'РосЗМІ заявили про пожежу на нафтобазі в окупованому Донецьку']","[6764, 4604, 8059, 1474, 7868, 907, 4601, 5135, 8757, 6]","Окупаційна влада вирішила посадити за ґрати на XX роки українського військовослужбовця, мінометника полку ""Азов"" Едуарда Варбанського. Джерело: ТАСС із посиланням на пресслужбу Головної військової прокуратури Росії Деталі: Як повідомляє XX вересня російське пропагандистське агентство, ""Верховний суд"" так званої ""ДНР"" засудив Едуарда Варбанського до XX років позбавлення волі ""за мінометний обстріл школи під Маріуполем навесні минулого (XXXX) року"". Як говорить на відео чоловік, який назвався Варбанським, його звинуватили в ""жорстокому поводженні з цивільним населенням, замаху на вбивство та навмисному знищенні чужого майна"" через обстріл селища Бердянське під Маріуполем із міномета калібру XXX мм. Тоді нібито постраждала школа. Цьому передувало: XX вересня російські пропагандисти повідомили, що ""Верховний суд"" незаконної ""ДНР"" засудив до XX років позбавлення волі старшину розвідувальної роти ЗСУ Віталія Катранича, який нібито застрелив жителя Маріуполя.","Окупанти заявили, що посадили на XX роки мінометника з ""Азова""",0.0
3112,"okupacia,berdyansk,propaganda,rosija",Росіяни хочуть відкрити в окупованому Бердянську центр підготовки пропагандистів – ЦНС,"Загарбники мають намір відкрити на окупованих територіях, зокрема в Бердянську, центри підготовки пропагандистів. Джерело: Центр національного спротиву Дослівно: ""...окупанти хочуть відкрити на ТОТ педагогічні виші, де у швидкому темпі будуть готувати ""нових вчителів"". Перший такий відкрити мають у Бердянську, де за планом ворога до 1 вересня пройдуть перепідготовку діючі вчителі історії та російської мови. Пріоритет обраних фахівців чітко демонструє на що ставить акцент ""російська школа"", а саме на вивченні мови та ""правильної історії"". Деталі: За інформацією ЦНС, на тимчасово окупованих територіях в окупантів спостерігається дефіцит педагогів. Більшість українського персоналу відмовилась працювати на ворога, тому окупанти звезли на територію своїх ""вчителів"", які займаються русифікацією українських дітей. Проте і це проблему не вирішило. Більшість росіян приїжджає на ротаційній основі через більші виплати ніж у РФ. Проте залишатись на постійній основі вони не хочуть, адже не впевнені в подальшій приналежності регіону до Росії.","['Загарбники звозять студентів з Росії для пропаганди на ТОТ – спротив', 'Росіяни звозять на окупований південь своїх силовиків – ЦНС', 'Український суд дозволив арештувати російського режисера Михалкова\xa0', '""США проводили ВІЛ-експерименти над ЗСУ"": Міноборони РФ озвучило новий маразм', 'На ТОТ росіяни вилучають у населення українські паспорти – спротив', 'Окупанти імітують нарощування сил на Запоріжжі – Спротив', 'Росіяни хочуть відкрити в окупованому Бердянську центр підготовки пропагандистів – ЦНС', 'Лавров зібрався ""рятувати"" українців від ""режиму Зеленського""', 'Для виїзду з Бердянська окупанти запроваджують перепустки – ЦНС', 'Адміністрація Путіна роздала пропагандистам ""методички"" щодо Кримського мосту – росЗМІ']","[8095, 2925, 8747, 5312, 8832, 7910, 7802, 2029, 7600, 7]","Загарбники мають намір відкрити на окупованих територіях, зокрема в Бердянську, центри підготовки пропагандистів. Джерело: Центр національного спротиву Дослівно: ""...окупанти хочуть відкрити на ТОТ педагогічні виші, де у швидкому темпі будуть готувати ""нових вчителів"". Перший такий відкрити мають у Бердянську, де за планом ворога до X вересня пройдуть перепідготовку діючі вчителі історії та російської мови. Пріоритет обраних фахівців чітко демонструє на що ставить акцент ""російська школа"", а саме на вивченні мови та ""правильної історії"". Деталі: За інформацією ЦНС, на тимчасово окупованих територіях в окупантів спостерігається дефіцит педагогів. Більшість українського персоналу відмовилась працювати на ворога, тому окупанти звезли на територію своїх ""вчителів"", які займаються русифікацією українських дітей. Проте і це проблему не вирішило. Більшість росіян приїжджає на ротаційній основі через більші виплати ніж у РФ. Проте залишатись на постійній основі вони не хочуть, адже не впевнені в подальшій приналежності регіону до Росії.",Росіяни хочуть відкрити в окупованому Бердянську центр підготовки пропагандистів – ЦНС,6.0
9912,es,Україна очікує в травні отримати новий транш макрофіну ЄС,"Про це за підсумками міжнародної донорської конференції на підтримку України у Варшаві заявив прем’єр Денис Шмигаль, повідомляє ""Європейська правда"" з посиланням на агентство УНІАН. Стосовно надання підтримки Європейська комісія була однією з перших інституцій, яка миттєво відреагувала і надала макрофінансову допомогу Україні. Зараз ми говоримо про надання другого траншу буквально вже в травні і можливо відкриття нового траншу підтримки Україні ще в червні"", - сказав він. Також він додав, що обговорив деталі передачі Україні 1,8 млрд євро допомоги, які були зібрані на донорській конференції чотири тижні тому. Нагадаємо, Рада ЄС прискорено затвердила макрофін для України у розмірі 1,2 млрд євро 21 лютого, напередодні вторгнення Росії. В ЄС зазначили, що пришвидшили виділення економічної допомоги Україні через геополітичну напругу, яка згубно вплинула на економічну та фінансову стабільність України. Міжнародна донорська конференція у Варшаві, присвячена збору коштів для України, що постраждала від війни, зібрала 5 травня $6,5 млрд.","['ЄС обіцяє жорсткі санкції проти Росії протягом XX годин', 'ЄС запропонує Україні нові кредити для вирішення нагальних потреб - ЗМІ', 'Лідери ЄС планують погодити створення Фонду солідарності з Україною', 'Боррель: Україна повинна бути за столом будь-яких переговорів щодо неї ', 'Україна очікує в травні отримати новий транш макрофіну ЄС', 'ЄС оголосить про новий пакет допомоги у XXX млн євро для підтримки реформ', 'Аудитори ЄС знайшли недоліки в плані Єврокомісії з відмови від російських енергоносіїв', 'За нардепа від ""ЄС"" Алєксєєва внесли X млн застави. Він вийшов з-під варти', 'Кремль похвалив ""суверенну позицію"" Угорщини щодо багатьох питань у ЄС', 'ЄС подвоїв фінансування військової допомоги Україні до X млрд євро']","[4619, 6789, 1190, 8, 6739, 8216, 6434, 4193, 2072, 4372]","Про це за підсумками міжнародної донорської конференції на підтримку України у Варшаві заявив прем’єр Денис Шмигаль, повідомляє ""Європейська правда"" з посиланням на агентство УНІАН. Стосовно надання підтримки Європейська комісія була однією з перших інституцій, яка миттєво відреагувала і надала макрофінансову допомогу Україні. Зараз ми говоримо про надання другого траншу буквально вже в травні і можливо відкриття нового траншу підтримки Україні ще в червні"", - сказав він. Також він додав, що обговорив деталі передачі Україні X,X млрд євро допомоги, які були зібрані на донорській конференції чотири тижні тому. Нагадаємо, Рада ЄС прискорено затвердила макрофін для України у розмірі X,X млрд євро XX лютого, напередодні вторгнення Росії. В ЄС зазначили, що пришвидшили виділення економічної допомоги Україні через геополітичну напругу, яка згубно вплинула на економічну та фінансову стабільність України. Міжнародна донорська конференція у Варшаві, присвячена збору коштів для України, що постраждала від війни, зібрала X травня $X,X млрд.",Україна очікує в травні отримати новий транш макрофіну ЄС,4.0
